name,url
Change is always permanent: the role of ChatGPT on knowledge workers' productivity and innovative behavior,https://www.emerald.com/jkm/article-abstract/doi/10.1108/JKM-01-2025-0091/1299995
Advancements and Applications of Generative Artificial Intelligence and show the Experimental Evidence on the Productivity Effects using Generative Artificial …,https://philpapers.org/rec/SAKAAA-5
The impact of generative AI on employment and labor productivity,https://search.proquest.com/openview/ef4a16ccdd3ada374a981a60edf32f2a/1?pq-origsite=gscholar&cbl=36534
Measuring the impact of AI on information worker productivity,https://papers.ssrn.com/sol3/papers.cfm?abstract_id=4648686
Transforming boundaries: how does ChatGPT change knowledge work?,https://www.emerald.com/jbs/article/45/3/214/191219
Trusting in generative AI: Catalyst for employee performance and engagement in the workplace,https://www.tandfonline.com/doi/abs/10.1080/10447318.2024.2388482
Enhancing Trust in LLM Chatbots for Workplace Support Through User Experience Design and Prompt Engineering,https://books.google.com/books?hl=en&lr=&id=8WYREQAAQBAJ&oi=fnd&pg=PA139&dq=(%22LLM%22+OR+%22large+language+model%22+OR+%22generative+AI%22+OR+%22ChatGPT%22+OR+%22AI+chatbot%22)+AND+(%22productivity%22+OR+%22workplace%22+OR+%22knowledge+work%22+OR+%22task+performance%22+OR+%22professional+writing%22+OR+%22writing+task%22+OR+%22essay+writing%22+OR+%22writing+assistant%22+OR+%22writing+assistance%22+OR+%22writing+skills%22+OR+%22cognitive+load%22+OR+%22cognitive+debt%22+OR+%22metacognition%22+OR+%22metacognitive%22+OR+%22self-regulated+learning%22+OR+%22learning+outcomes%22+OR+%22learning+engagement%22+OR+%22student+engagement%22+OR+%22academic+engagement%22+OR+%22AI+tutor%22+OR+%22tutor%22+OR+%22homework+tutor%22+OR+%22mathematics%22+OR+%22high+school+math%22+OR+%22programming%22+OR+%22programming+assignment%22+OR+%22compiler+error%22+OR+%22automated+assessment%22+OR+%22feedback%22+OR+%22reading+comprehension%22+OR+%22note-taking%22+OR+%22memory+retention%22+OR+%22critical+thinking%22+OR+%22higher+education%22+OR+%22EFL+writing%22+OR+%22assistive+technology%22+OR+%22visual+disability%22+OR+%22GitHub+Copilot%22+OR+%22Copilot%22)&ots=NBGVzDYajU&sig=PmlbT9qJ8B65ITSbILPFRJBNAS4
Can generative artificial intelligence productivity tools support workplace learning? A qualitative study on employee perceptions in a multinational corporation,https://www.emerald.com/insight/content/doi/10.1108/jwl-11-2024-0258/full/html
Generative AI for Productivity in Industry and Education.,https://www.researchgate.net/profile/Ali-Emrouznejad/publication/379909992_COMPLEXIS_2024_Proceedings_of_the_9th_International_Conference_on_Complexity_Future_Information_Systems_and_Risk/links/662186f0f7d3fc28746d02b0/COMPLEXIS-2024-Proceedings-of-the-9th-International-Conference-on-Complexity-Future-Information-Systems-and-Risk.pdf#page=139
Assessing the Impact of ChatGPT on EFL Students' Writing Productivity and Proficiency,https://search.proquest.com/openview/35665f25b9bef7188aa4640c6b78843a/1?pq-origsite=gscholar&cbl=136091
Enhancing efficiency in scientific writing in the field of plant growing: Collaborating with AI assistant ChatGPT for enhanced productivity.,https://search.ebscohost.com/login.aspx?direct=true&profile=ehost&scope=site&authtype=crawler&jrnl=23675144&AN=174270159&h=9u7t6p2mNeKpN7MPrLQKdPxRTk%2Fxq3653nEe5B5s3XzwI4hG%2F4VZkM07sdya8QX%2FBY1GMxbpzWANkfc1xj0eig%3D%3D&crl=c
From virtual assistant to writing mentor: Exploring the impact of a ChatGPT-based writing instruction protocol on EFL teachers' self-efficacy and learners' writing skill,https://journals.sagepub.com/doi/abs/10.1177/13621688241239764
HELP ME CHATGPT! WHAT WAYS DOES CHATGPT INFLUENCE STUDENTS'PRODUCTIVITY AND CREATIVITY IN ENGLISH ACADEMIC WRITING?,http://ojs.jurnalbk.com/index.php/educatum/article/view/65
Interacting with ChatGPT in essay writing: A study of L2 learners' task motivation,https://www.cambridge.org/core/journals/recall/article/interacting-with-chatgpt-in-essay-writing-a-study-of-l2-learners-task-motivation/720D0AD1F515BDD36E44713A73B8EF3D
"Unleashing pre-service language teachers' productivity with generative AI: Emotions, appraisal and coping strategies",https://www.sciencedirect.com/science/article/pii/S0747563224002851
"Learning, teaching, and assessment with generative artificial intelligence: towards a plateau of productivity",https://www.tandfonline.com/doi/full/10.1080/23735082.2023.2264086
Utilizing ChatGPT to improve the productivity of nursing students in higher education,https://www.researchgate.net/profile/Ahmed-Alkhaqani/publication/376807456_Utilizing_ChatGPT_to_Improve_the_Productivity_of_Nursing_Students_in_Higher_Education/links/658986040bb2c7472b0fb825/Utilizing-ChatGPT-to-Improve-the-Productivity-of-Nursing-Students-in-Higher-Education.pdf
Generative AI in education: To embrace it or not?,https://www.ijabe.org/index.php/ijabe/article/view/8486/0
Analyzing the role of ChatGPT as a writing assistant at higher education level: A systematic review of the literature,https://www.cedtech.net/article/analyzing-the-role-of-chatgpt-as-a-writing-assistant-at-higher-education-level-a-systematic-review-13605
Dear Diary: A randomized controlled trial of Generative AI coding tools in the workplace,https://ieeexplore.ieee.org/abstract/document/11121735/
EFL secondary students' use of ChatGPT for writing task completion pathways,https://www.tandfonline.com/doi/abs/10.1080/00220671.2025.2510382
Ironies of generative AI: understanding and mitigating productivity loss in Human-AI interaction,https://www.tandfonline.com/doi/abs/10.1080/10447318.2024.2405782
AI in the workplace: Examining the effects of ChatGPT on information support and knowledge acquisition,https://www.tandfonline.com/doi/abs/10.1080/10447318.2023.2278283
Understanding the impact of an organisational LLM agent on the collaborative practices of knowledge work,https://www.researchsquare.com/article/rs-7601582/latest
Human-artificial intelligence collaboration in the modern workplace: Maximizing productivity and transforming job roles,https://papers.ssrn.com/sol3/papers.cfm?abstract_id=5057414
Enhancing Writing Skills through ChatGPT: an Experimental Study in the Context of Ergonomics,https://www.ceeol.com/search/article-detail?id=1222879
Conversational artificial intelligence in the workplace: Analysing the impact of ChatGPT on users' perceived self-efficacy,https://ieeexplore.ieee.org/abstract/document/10551239/
From efficiency to innovation: Llm 5.0 and the future of industry,https://ieeexplore.ieee.org/abstract/document/10894335/
The AI Revolution in Project Management: Elevating Productivity with Generative AI,https://books.google.com/books?hl=en&lr=&id=sXriEAAAQBAJ&oi=fnd&pg=PT14&dq=(%22LLM%22+OR+%22large+language+model%22+OR+%22generative+AI%22+OR+%22ChatGPT%22+OR+%22AI+chatbot%22)+AND+(%22productivity%22+OR+%22workplace%22+OR+%22knowledge+work%22+OR+%22task+performance%22+OR+%22professional+writing%22+OR+%22writing+task%22+OR+%22essay+writing%22+OR+%22writing+assistant%22+OR+%22writing+assistance%22+OR+%22writing+skills%22+OR+%22cognitive+load%22+OR+%22cognitive+debt%22+OR+%22metacognition%22+OR+%22metacognitive%22+OR+%22self-regulated+learning%22+OR+%22learning+outcomes%22+OR+%22learning+engagement%22+OR+%22student+engagement%22+OR+%22academic+engagement%22+OR+%22AI+tutor%22+OR+%22tutor%22+OR+%22homework+tutor%22+OR+%22mathematics%22+OR+%22high+school+math%22+OR+%22programming%22+OR+%22programming+assignment%22+OR+%22compiler+error%22+OR+%22automated+assessment%22+OR+%22feedback%22+OR+%22reading+comprehension%22+OR+%22note-taking%22+OR+%22memory+retention%22+OR+%22critical+thinking%22+OR+%22higher+education%22+OR+%22EFL+writing%22+OR+%22assistive+technology%22+OR+%22visual+disability%22+OR+%22GitHub+Copilot%22+OR+%22Copilot%22)&ots=mPi3T2H63w&sig=-6O1Ao_gl3-bZCeBCJTFE6XfzxI
A Systematic Literature Review on the Use of ChatGPT to Support Productivity of Software Developers,https://aisel.aisnet.org/amcis2025/sig_odis/sig_odis/17/
Usability of ChatGPT in the english essay writing proficiency of the BEED students,https://jse.rezkimedia.org/index.php/jse/article/view/338
Generative AI and Multifactor Productivity in Business,https://books.google.com/books?hl=en&lr=&id=n-UEEQAAQBAJ&oi=fnd&pg=PR1&dq=(%22LLM%22+OR+%22large+language+model%22+OR+%22generative+AI%22+OR+%22ChatGPT%22+OR+%22AI+chatbot%22)+AND+(%22productivity%22+OR+%22workplace%22+OR+%22knowledge+work%22+OR+%22task+performance%22+OR+%22professional+writing%22+OR+%22writing+task%22+OR+%22essay+writing%22+OR+%22writing+assistant%22+OR+%22writing+assistance%22+OR+%22writing+skills%22+OR+%22cognitive+load%22+OR+%22cognitive+debt%22+OR+%22metacognition%22+OR+%22metacognitive%22+OR+%22self-regulated+learning%22+OR+%22learning+outcomes%22+OR+%22learning+engagement%22+OR+%22student+engagement%22+OR+%22academic+engagement%22+OR+%22AI+tutor%22+OR+%22tutor%22+OR+%22homework+tutor%22+OR+%22mathematics%22+OR+%22high+school+math%22+OR+%22programming%22+OR+%22programming+assignment%22+OR+%22compiler+error%22+OR+%22automated+assessment%22+OR+%22feedback%22+OR+%22reading+comprehension%22+OR+%22note-taking%22+OR+%22memory+retention%22+OR+%22critical+thinking%22+OR+%22higher+education%22+OR+%22EFL+writing%22+OR+%22assistive+technology%22+OR+%22visual+disability%22+OR+%22GitHub+Copilot%22+OR+%22Copilot%22)&ots=WTy38qYYGj&sig=ngbvNcrcNr7P7QUcXo28mT1K2KY
Future of Productivity Management: The Role of Generative AI,https://www.igi-global.com/chapter/future-of-productivity-management/368885
THE LLM PRODUCTIVITY CLIFF: THRESHOLD PRODUCTIVITY AND AI-NATIVE INEQUALITY,https://www.authorea.com/doi/full/10.22541/au.176479278.82636337
Leveraging AI ChatGPT as a Research Assistant: An Analysis of Its Impact on Productivity and Research Output among Graduate Students in Pakistan,http://jals.miard.org/index.php/jals/article/view/173
Addressing the productivity paradox in healthcare with retrieval augmented generative AI chatbots,https://ieeexplore.ieee.org/abstract/document/10540818/
Using artificial intelligence in academic writing and research: An essential productivity tool,https://www.sciencedirect.com/science/article/pii/S2666990024000120
Organizing for Generative AI and the Productivity Revolution: Reshaping Organizational Roles in the Age of Artificial Intelligence,https://books.google.com/books?hl=en&lr=&id=vbUvEQAAQBAJ&oi=fnd&pg=PR5&dq=(%22LLM%22+OR+%22large+language+model%22+OR+%22generative+AI%22+OR+%22ChatGPT%22+OR+%22AI+chatbot%22)+AND+(%22productivity%22+OR+%22workplace%22+OR+%22knowledge+work%22+OR+%22task+performance%22+OR+%22professional+writing%22+OR+%22writing+task%22+OR+%22essay+writing%22+OR+%22writing+assistant%22+OR+%22writing+assistance%22+OR+%22writing+skills%22+OR+%22cognitive+load%22+OR+%22cognitive+debt%22+OR+%22metacognition%22+OR+%22metacognitive%22+OR+%22self-regulated+learning%22+OR+%22learning+outcomes%22+OR+%22learning+engagement%22+OR+%22student+engagement%22+OR+%22academic+engagement%22+OR+%22AI+tutor%22+OR+%22tutor%22+OR+%22homework+tutor%22+OR+%22mathematics%22+OR+%22high+school+math%22+OR+%22programming%22+OR+%22programming+assignment%22+OR+%22compiler+error%22+OR+%22automated+assessment%22+OR+%22feedback%22+OR+%22reading+comprehension%22+OR+%22note-taking%22+OR+%22memory+retention%22+OR+%22critical+thinking%22+OR+%22higher+education%22+OR+%22EFL+writing%22+OR+%22assistive+technology%22+OR+%22visual+disability%22+OR+%22GitHub+Copilot%22+OR+%22Copilot%22)&ots=dYPFACExlb&sig=3zAVdcMRVykPpMZA6bTVIong6lk
Practical Generative AI with ChatGPT: Unleash your prompt engineering potential with OpenAI technologies for productivity and creativity,https://books.google.com/books?hl=en&lr=&id=u2JREQAAQBAJ&oi=fnd&pg=PP1&dq=(%22LLM%22+OR+%22large+language+model%22+OR+%22generative+AI%22+OR+%22ChatGPT%22+OR+%22AI+chatbot%22)+AND+(%22productivity%22+OR+%22workplace%22+OR+%22knowledge+work%22+OR+%22task+performance%22+OR+%22professional+writing%22+OR+%22writing+task%22+OR+%22essay+writing%22+OR+%22writing+assistant%22+OR+%22writing+assistance%22+OR+%22writing+skills%22+OR+%22cognitive+load%22+OR+%22cognitive+debt%22+OR+%22metacognition%22+OR+%22metacognitive%22+OR+%22self-regulated+learning%22+OR+%22learning+outcomes%22+OR+%22learning+engagement%22+OR+%22student+engagement%22+OR+%22academic+engagement%22+OR+%22AI+tutor%22+OR+%22tutor%22+OR+%22homework+tutor%22+OR+%22mathematics%22+OR+%22high+school+math%22+OR+%22programming%22+OR+%22programming+assignment%22+OR+%22compiler+error%22+OR+%22automated+assessment%22+OR+%22feedback%22+OR+%22reading+comprehension%22+OR+%22note-taking%22+OR+%22memory+retention%22+OR+%22critical+thinking%22+OR+%22higher+education%22+OR+%22EFL+writing%22+OR+%22assistive+technology%22+OR+%22visual+disability%22+OR+%22GitHub+Copilot%22+OR+%22Copilot%22)&ots=LFDzAm3bjN&sig=RCalbS8wErdddU-QrEOXZytxJyc
Using ChatGPT as a writing assistant: A study on essay quality development among Indonesian EFL University Students,https://vm113.upi.edu/index.php/ijal/article/view/258
Artificial intelligence-based language modelling: The effect of ChatGPT application on writing skills in the context of teaching English as a foreign language,https://acikerisim.uludag.edu.tr/items/68ddad61-a55a-401a-8729-df5fc3c13eb7
ChatGPT and Improvement in Productivity: An analytical Study,https://bbejournal.com/BBE/article/view/1022
Appropriateness of llm-equipped robotic well-being coach language in the workplace: A qualitative evaluation,https://ieeexplore.ieee.org/abstract/document/10731269/
The Impact of ChatGPT on Academic Writing Skills and Knowledge: An Investigation of Its Use in Argumentative Essays.,https://eric.ed.gov/?id=EJ1470999
The Effect of Generative AI on the Productivity of Consultants,https://search.proquest.com/openview/a02304b5d86922dacfe44d2c451d739f/1?pq-origsite=gscholar&cbl=2026366&diss=y
THE IMPACT OF GENERATIVE AI ON WORKFORCE PRODUCTIVITY AND CREATIVE PROBLEM SOLVING,https://papers.ssrn.com/sol3/papers.cfm?abstract_id=5268208
Generative AI: boosting adaptability and reducing workplace overload,https://www.tandfonline.com/doi/abs/10.1080/08874417.2024.2417672
Collaborative processing of ChatGPT-generated feedback: Effects on L2 writing task improvement and learning,https://scholarspace.manoa.hawaii.edu/items/46bc7cb5-5d37-48a4-9cfd-881d5fa69643
Exploring the impacts of chatgpt on future scientific work,https://www.researchgate.net/profile/Claire-Mason-9/publication/372380638_Exploring_the_Impacts_of_ChatGPT_on_Future_Scientific_Work/links/64d2ffe8d3e680065aa1dc43/Exploring-the-Impacts-of-ChatGPT-on-Future-Scientific-Work.pdf
