title,abstract
Optimizing academic engagement and mental health through AI: an experimental study on LLM integration in higher education,"Background
In alignment with UNESCO's Sustainable Development Goal 4 (SDG4), which advocates for inclusive and equitable quality education, the integration of Artificial Intelligence tools—particularly Large Language Models (LLMs)—presents promising opportunities for transforming higher education. Despite this potential, empirical research remains scarce regarding the effects of LLM use on students' academic performance, mental well-being, and engagement, especially across different modes of implementation.
Objective
This experimental study investigated whether a guided, pedagogically grounded use of LLMs enhances students' academic writing quality, perceived mental health, and academic engagement more effectively than either unguided use or no exposure to LLMs. The study contributes to UNESCO's ""Futures of Education"" vision by exploring how structured AI use may foster more inclusive and empowering learning environments.
Method
A total of 246 undergraduate students were randomly assigned to one of three conditions: guided LLM use, unguided LLM use, or a control group with no LLM access. Participants completed a critical writing task and standardized instruments measuring academic engagement and mental well-being. Prior academic achievement was controlled for, and writing quality was assessed using Grammarly for Education.
Results
Students in the guided LLM condition achieved significantly higher scores in writing quality and academic engagement compared to the control group, with large and moderate effect sizes, respectively. Modest improvements in mental health indicators were also observed. By contrast, unguided use yielded moderate gains in writing quality but did not produce significant effects on engagement or well-being.
Conclusion
The findings highlight the critical role of intentional instructional design in the educational integration of AI tools. Structured guidance not only optimizes academic outcomes but also supports students' well-being and inclusion. This study offers empirical evidence to inform ongoing debates on how digital innovation can contribute to reducing educational disparities and advancing equitable learning in the post-pandemic era."
Impact of LLM Feedback on Learner Persistence in Programming,"Abstract
This study examines how Large Language Model (LLM) feedback generated for compiler errors impacts learners’ persistence in programming tasks within a system for automated assessment of programming assignments. Persistence, the ability to maintain effort in the face of challenges, is crucial for academic success but can sometimes lead to unproductive"" wheel spinning"" when students struggle without progress. We investigated how additional LLM feedback based on the GPT-4 model, provided for compiler errors affects learners’ persistence within a CS1 course. Specifically, we examined whether its impacts differ based on task difficulty, and if the effects persist after the feedback is removed. A randomized controlled trial involving 257 students across various programming tasks was conducted. Our findings reveal that LLM feedback improved some aspects of students’ performance and persistence, such as increased scores, a higher likelihood of solving problems, and a lower tendency to demonstrate unproductive"" wheel spinning"" behavior. Notably, this positive impact was also observed in challenging tasks. However, its benefits did not sustain once the feedback was removed. The results highlight both the potential and limitations of LLM feedback, pointing out the need to promote long-term skill development and learning independent of immediate AI assistance."
Effects of LLM Use and NoteTaking on Reading Comprehension and Memory: A Randomised Experiment in Secondary Schools,"The rapid uptake of Generative AI, particularly large language models (LLMs), by students raises urgent questions about their effects on learning. We compared the impact of LLM use to that of traditional note-taking, or a combination of both, on secondary school students' reading comprehension and retention. We conducted a pre-registered, randomised controlled experiment with within-and between-participant design elements in schools. 405 students aged 14-15 studied two text passages and completed comprehension and retention tests three days later. Quantitative results demonstrated that both note-taking alone and combined with the LLM had significant positive effects on retention and comprehension compared to the LLM alone. Yet, most students preferred using the LLM over note-taking, and perceived it as more helpful. Qualitative results revealed that many students valued LLMs for making complex material more accessible and reducing cognitive load, while they appreciated note-taking for promoting deeper engagement and aiding memory. Additionally, we identified ""archetypes"" of prompting behaviour, offering insights into the different ways students interacted with the LLM. Overall, our findings suggest that, while note-taking promotes cognitive engagement and long-term comprehension and retention, LLMs may facilitate initial understanding and student interest. The study reveals the continued importance of traditional learning approaches, the benefits of combining AI use with traditional learning over using AI alone, and the AI skills that students need to maximise those benefits."
Exploring the Impact of Generative AI ChatGPT on Critical Thinking in Higher Education: Passive AI?Directed Use or Human–AI Supported Collaboration?,"Generative AI is weaving into the fabric of many human aspects through its transformative power to mimic human-generated content. It is not a mere technology; it functions as a generative virtual assistant, raising concerns about its impact on cognition and critical thinking. This mixed-methods study investigates how GenAI ChatGPT affects critical thinking across cognitive presence (CP) phases. Forty students from a four-year university in the southwestern United States completed a survey; six provided their ChatGPT scripts, and two engaged in semi-structured interviews. Students’ self-reported survey responses suggested that GenAI ChatGPT improved triggering events (M = 3.60), exploration (M = 3.70), and integration (M = 3.60); however, responses remained neutral during the resolution stage. Two modes of interaction were revealed in the analysis of students’ ChatGPT scripts: passive, AI-directed use and collaborative, AI-supported interaction. A resolution gap was identified; nonetheless, the interview results revealed that when GenAI ChatGPT was utilized with guidance, all four stages of cognitive presence were completed, leading to enhanced critical thinking and a reconceptualization of ChatGPT as a more knowledgeable other. This research suggests that the effective use of GenAI in education depends on the quality of human–AI interaction. Future directions must orient toward an integration of GenAI in education that positions human and machine intelligence not as a substitution but as co-participation, opening new epistemic horizons while reconfiguring assessment practices to ensure that human oversight, critical inquiry, and reflective thinking remain at the center of learning."
The Impact of ChatGPT on English as a Foreign Language Learners' Writing Skills – An Experimental Study at Georgian Universities,"This study explores the impact of ChatGPT on English as a Foreign Language (EFL) students' writing skills. The integration of advanced AI tools like ChatGPT has transformed educational experiences, offering significant potential to enhance writing competence through personalized feedback and interactive writing practice. Conducted in a Georgian higher education context, the study involved 33 B2-level students divided into experimental and control groups over six weeks. The experimental group used ChatGPT for writing assistance, while the control group received traditional instruction. Results showed that ChatGPT significantly improved students' writing performance, highlighting its efficacy as an educational tool. However, concerns about ethical use and over-reliance on AI were noted, emphasizing the need for a balanced integration of technology in language learning."
